{
  "schemaVersion": 1,
  "evidenceClass": "unit-contract",
  "status": "passed",
  "recordedAt": "2026-10-04T03:27:17Z",
  "source": {
    "commit": "b969a32caaa250f81b75fd6ced34d42e34d7b855",
    "dirty": false
  },
  "environment": {
    "operatingSystem": "macOS 26.6.2",
    "build": "25G83",
    "architecture": "arm64",
    "hardwareModel": "Mac16,8",
    "memoryBytes": 25769803776,
    "toolVersions": {
      "Swift": "Apple Swift version 6.3.3 (swiftlang-6.3.3.1.3 clang-2100.1.1.101)",
      "Xcode": "Xcode 26.6\nBuild version 17F113"
    }
  },
  "commands": [
    {
      "command": "scripts/test.sh full",
      "exitCode": 0,
      "durationMilliseconds": 4095000
    }
  ],
  "rawResults": {
    "executed": 70,
    "passed": 70,
    "failed": 0,
    "blocked": 0
  },
  "failures": [],
  "blockers": [],
  "cleanup": {
    "status": "not-required",
    "exactResourceIdentifiers": [],
    "message": "Selected named unit contracts only; no device, installed-package, whole-regression temporary-directory or live-runtime cleanup claim."
  }
}
